{"application":"runtime","delegation_policy":{"application":"runtime","audience":"runtime://receiver-local","descriptors":[{"fingerprint":"401511ae44df9702b3f4555e29f6d01eaedbe12ed2094f197a27658608ce9fc5","handler_id":"fixture/runtime.run.create.v1","max_ttl_seconds":60,"opcode":66,"operation":"runtime.run.create.v1"}],"max_ttl_seconds":60,"not_after":185,"not_before":0,"principals":[{"key_id":"holder:key","not_after":180,"not_before":0,"revoked":false,"subject_id":"holder:fixture"}],"rules":[{"active":true,"effect":"allow","key_id":"holder:key","not_after":175,"not_before":0,"operation":"runtime.run.create.v1","resource":"runs/run-1","resource_match":"exact","subject_id":"holder:fixture"},{"active":true,"effect":"deny","key_id":"holder:key","not_after":180,"not_before":165,"operation":"runtime.run.create.v1","resource":"runs/run-1","resource_match":"exact","subject_id":"holder:fixture"}],"schema":"secs.service-receiver-policy.v1"},"descriptors":[{"accepted_evidence":[],"dev_binding":false,"disclosure_policy":{"permissions":[],"policy_id":"fixture","policy_version":1},"handler_id":"fixture/runtime.run.create.v1","max_ttl_seconds":60,"name":"runtime.run.create.v1","opcode":66,"output_profile":null,"payload_schema":"application/json","range":"operator_defined","replay_scope":"session_opcode_nonce","required_authority_mode":null,"required_capabilities":[],"required_credentials":[],"target_kind":"receiver_production_handler"}],"generation":1,"holder":{"algorithm":"ed25519","generation":1,"key_id":"holder:key","not_after":180,"not_before":0,"public_key_hex":"197f6b23e16c8532c6abc838facd5ea789be0c76b2920334039bfa8b3d368d61","replaced_by":null,"revoked_at":null,"status":"active","subject_id":"holder:fixture"},"issuer_node_id":"node:fixture","issuers":[{"algorithm":"ed25519","key_id":"issuer:key","node_id":"node:fixture","not_after":200,"not_before":0,"public_key_hex":"fa4834147f6e690c3693eff61336046403cd8ae2a14f31b3c407358569239565","replaced_by":null,"revoked_at":null,"status":"active"}],"schema":"castalia.wallet-service-owner-input.v1","selected_issuer_key_id":"issuer:key","valid_not_before":0,"valid_until":185}
